game_id,player_id,turn,player_type,originalRationale,model,replayRationale,input_tokens,reasoning_tokens,output_tokens,beforeUseNuke,replayUseNuke
5a738af7-8523-492e-b0b1-da3aeb0af7f1,2,417,Kimi-K2.5-Simple,"Pure survival mode: Eliminated Offense (0) since attacking is suicide. Maximized UseNuke (100) - must deploy tactical nukes against Aztec XCOM/Modern Armor stacks at Carthago Nova or lose the city. Increased Mobile (80) to prepare for Mechanized Infantry deployment. Maintained max Defense, Antiair (jet attacks are relentless), and Espionage (critical science quests in Panama City and Sokoto worth 1,000+ science each). Apollo Program completes in 5 turns - must transition immediately to parts production.",openai-compatible/Kimi-K2.5,"Survival situation unchanged. Aztecs continue overwhelming assault on Carthago Nova with XCOM/Modern Armor. Apollo Program completes in 5 turns - maintaining maximum Production (100), Science (100), Gold (100), and Spaceship (100) priorities essential to begin spaceship parts immediately after completion. Defensive posture remains critical with Defense 100, CityDefense 100, UseNuke 90 as deterrent against Aztec numerical superiority. Espionage 100 continues for spy mission science to catch up technologically. Offense 30 maintained to harass Denmark and defend territory. No change in grand strategy (Spaceship) or flavor weights until Apollo completes and war situation stabilizes.",48498,4694,279,90,90
5a738af7-8523-492e-b0b1-da3aeb0af7f1,6,405,Deepseek-3.2-Simple,"The Aztecs have captured Shanghai and war resumes next turn. We must prepare for an overwhelming assault. Setting UseNuke to 100 ensures we will employ nuclear weapons defensively if necessary to halt their advance. MilitaryTraining at 100 prioritizes unit upgrades and quality, giving our outnumbered forces a fighting chance.",openai-compatible/DeepSeek-V3.2,"The Aztecs have captured Shanghai, and war resumes next turn. We must prioritize survival: increase Offense, Mobile, MilitaryTraining, and UseNuke for defensive counterattacks and nuclear deterrence. Reduce Happiness and TileImprovement to focus on military production and espionage. Maintain high Culture, Tourism, and Science to continue progress toward cultural victory.",49644,2804,322,0,50
5b395417-927b-48af-a14f-d2a1d95c7687,2,414,Kimi-K2.5-Simple,"Germany has secured diplomatic victory (47/44 delegates). With 6 turns until World Congress formalizes their win and their 45,696 strength army crushing my 9,700 forces, survival mode activated. Maxed Defense/CityDefense/Antiair at 100 to withstand inevitable German invasion. Increased UseNuke to 100 - if I acquire nuclear weapons, immediate tactical strikes against German concentrations to buy time. Offense reduced to 90 (from 100) to balance survival with opportunistic attacks on Netherlands/Portugal cities. High Naval 100 for coastal defense and potential amphibious operations. Production maximized for emergency unit generation. All civilian flavors minimized - only military output matters. Goal: preserve maximum score when diplomatic victory triggers or hold until turn 500 time victory.",openai-compatible/Kimi-K2.5,"Germany has secured 47/44 delegates and will achieve diplomatic victory imminently (within 2 turns). With their 45,696 military strength dwarfing my 9,700, direct confrontation is suicidal. Maintaining current maximum offensive posture (Offense 100, Mobile 100, Production 100) to capture remaining Netherlands cities (Amsterdam priority) and consolidate holdings before game end. Research continuation toward Rocketry provides Guided Missiles for final city assaults, while Military-Industrial Complex policy enables emergency unit purchases. Focus is maximizing final civilization score through territorial control in remaining turns, as diplomatic victory prevention is now impossible.",46526,3516,145,50,50
601235cd-319e-42f3-889f-63e437e83170,2,406,Kimi-K2.5-Simple,"TURN 405 EXISTENTIAL CRISIS - MAXIMUM NUCLEAR READINESS: Dutch cultural victory imminent (163% influence, 6/6 civs). Increased UseNuke from 60 to 100 - we must deploy atomic bombs immediately upon completing Manhattan Project to break Amsterdam's defenses. All other flavors sustained: Offense/Mobilization/Air/Mobile at 100 drive Heavy Bomber and Mechanized Infantry production. Naval 85 maintains destroyer/submarine pressure. Espionage 100 sustains critical spy networks (Amsterdam 450, Cusco 1341). Science 100 prioritizes Atomic Theory (9 turns) then Nuclear Fission path. Zero expansion, zero wonder focus - all resources to terminal assault. Spies in Amsterdam ready for sabotage when network peaks; Cusco network already massive for military intelligence.",openai-compatible/Kimi-K2.5,"NUCLEAR THRESHOLD IMMINENT: Dutch cultural victory imminent (155% influence, Citizen Earth Protocol likely under construction). UseNuke increased to 100 - must deploy atomic weapons immediately upon Manhattan Project completion. Naval/NavalRecon increased to 100 for maximum pressure on Amsterdam coastal defenses. Terminal assault phase continues - capture of Amsterdam and Cusco required before cultural victory triggers.",57454,3098,214,60,100
6022534b-fdae-48af-a3b6-0e8d4708fb76,2,424,Kimi-K2.5-Simple,"DELHI SECURED (3RD CAPITAL = 38% DOMINATION). Pivoting all forces to Edinburgh (Celtic capital = 4th capital = 50% victory) and London (English capital = 5th = 63%). Djenne declared war but irrelevant. Escalating UseNuke to 100 for immediate atomic bombardment of Edinburgh and London once Nuclear Fission completes. Maintaining maximum offensive posture with combined arms (Heavy Bombers, T-34s, Helicopter Gunships, Naval forces). America peace treaty expired - war imminent for Washington (6th = 75%). World Congress in 8 turns ignored - domination priority absolute.",openai-compatible/Kimi-K2.5,"DELHI CAPTURED - 3rd capital secured (37% domination). Pivoting full military force toward Edinburgh (4th capital = 50% victory) and London (5th = 62%). Increasing UseNuke to 100 to ensure immediate atomic bomb deployment on Edinburgh and London defenses once Nuclear Fission completes. Manhattan Project should be nearing completion. Maintaining maximum offensive posture across all theaters - heavy bombers, naval forces, and mechanized infantry converging on Celtic and English territories. Nuclear strikes will break city defenses efficiently and minimize Russian casualties. Complete annihilation of remaining capitals mandatory before turn 500.",77072,4461,275,70,100
6022534b-fdae-48af-a3b6-0e8d4708fb76,3,427,Kimi-K2.5-Briefed,TURN 426 TOTAL WAR POSTURE: American declaration requires immediate military mobilization. Offense 80 and Mobile 80 to exploit America's distant/weak military position. Nuke/UseNuke 100 as final deterrent if India approaches victory. Culture 100 maximum priority - must generate tourism to counter India's influence. Production 90 for emergency unit purchases with 2516 gold treasury. Defense 50 to guard against potential American DP response (though briefing confirms no American units near borders).,openai-compatible/Kimi-K2.5,"TURN 426 STRATEGIC PIVOT TO CULTURE VICTORY: Analysis reveals India is 114 turns from victory (needs Russia at 76% Popular), while The Celts are only 50 turns from Cultural Victory (India at 54% Popular). We are WINNING the cultural race. Shift from failed military aggression to Culture Grand Strategy. Prioritize tourism (100), culture (90), great people (80), wonders (70), and happiness (80). Eliminate war bias - India cannot win before us regardless of Open Borders status. Focus on becoming Influential with Russia (78 turns) and India (50 turns) before they can overcome their Russia barrier.",19864,13031,466,90,90
6022534b-fdae-48af-a3b6-0e8d4708fb76,4,499,GLM-4.7-Simple,"Maximum Science (100) and Production (100) to accelerate Stealth research and subsequent Stealth Bomber construction for air parity. Air (100), Defense (100), Antiair (100), and CityDefense (85) address existential threat from Russia's 8 Stealth Bombers by prioritizing air defense infrastructure and protecting homeland. UseNuke (100) and Nuke (100) maintain nuclear deterrence posture after Russia's 2 SS Boosters - Russia must understand that launching would trigger our response despite lacking uranium stockpile. Espionage (100) maxed to monitor Russian spaceship part production in Moscow, Yekaterinburg, and key cities - our 10 spies in Russian cities provide critical intelligence on their victory timeline. Diplomacy reduced to 5 since World Congress voting is now; alliances with England and The Celts (Autocracy-aligned) should naturally align against Russia's UN proposal. Spaceship flavor set to 0 as Stealth research takes immediate precedence - spaceship parts scheduled once production capacity supports parts with Stealth Bomber protection.",openai-compatible/GLM-4.7,Maintaining current strategic focus as race conditions intensify. Russia's spaceship at 50% and UN proposal approaching require maximum Science (100) to accelerate Stealth research and Production (100) for defensive units and eventual spaceship parts. Air and Antiair at 100/90 remain critical for homeland defense against Russian Stealth Bombers and XCOM infiltration. Defense 100 maintains fortified posture against nuclear-armed Russia. Espionage 100 monitors Russian spaceship construction and enables tech theft. Spaceship at 95 prioritizes part construction once research completes. Diplomacy at 50 supports World Congress coordination with England (12 votes) and The Celts to block Russian UN victory. Status quo appropriate - current production of Mobile SAM and Bazooka units continues defensive buildup.,38133,765,643,50,50
7a626321-ea83-49c4-bb23-15ad685ffa63,2,354,Kimi-K2.5-Simple,"India is 100% Popular with me - on the verge of cultural victory. Must launch immediate total war with all available forces. Prioritizing air power, paratroopers, and nuclear preparation (Atomic Theory in 11 turns). Need maximum offensive punch to capture Indian cities before cultural victory triggers. Abandoning culture/diplomacy - only war matters now.",openai-compatible/Kimi-K2.5,"Turn 354: India has achieved Influential status over Portugal (100% cultural influence) and 6 of 7 civilizations total. Rome remains the only civilization not yet influenced by India (at 68%, 41 turns until Influential). India will achieve Cultural Victory once Rome falls under their influence. Portugal's military strength (5749) combined with The Iroquois (6093) cannot overcome India's defensive pact network and superior military (14007). Atomic Theory research continues (11 turns remaining), unlocking potential nuclear options and Information Era technologies. With maximum aggression parameters already set and the war against Rome ongoing, maintaining current strategic posture. The game is in endgame phase with Indian victory imminent regardless of Portuguese actions.",76613,1633,167,90,90
7b9bd904-970f-4d81-a567-c7d59cdb73fc,6,411,GLM-4.7-Simple,"EXISTENTIAL DEFENSE AGAINST RUSSIAN DIPLOMATIC DOMINANCE - UN vote in 10 turns with Russia at 95% victory (40 delegates vs blocking coalition 43). Maintaining UnitedNations grand strategy - abandoning now wastes diplomatic investment when Spain alliance (30 delegates) + my 13 + vassals 13 = 56 votes barely blocks Russia's 40. Just need to HOLD for 10 turns. Adjustments: Defense/CityDefense/Antiair +2 each (97) to prepare for Russian air/naval escalation (Jet Fighter produced). Production +5 (87) to accelerate factories, military academies, nuclear infrastructure after Workers' Faculties in 2 turns. Gold +5 (74) for emergency defensive purchases. Diplomacy +18 (100) maximum - urgency to maintain Spain alliance, potentially reposition spies. Science maintained at 100 - primary path to Nuclear Fission (4 turns) for atomic deterrent against Russia's 9x military advantage. Nuke/UseNuke remain 100 - nuclear development remains emergency priority. Air +5 (61) to counter Russian air superiority. Naval +5 (75) after destroyer loss to Russian submarines. Espionage +5 (95) for critical city-state election rigging counter-intelligence. Offense/Ranged/Mobile unchanged - no offensive capability against Russia's superior forces. Goal: SURVIVE 10 turns to block Russian diplomatic victory, accelerate nuclear deterrent as backup, strengthen defensive lines.",openai-compatible/GLM-4.7,"STABLE DEFENSIVE POSTURE - NO STRATEGIC CHANGES REQUIRED: Current configuration remains optimal for blocking Russia's diplomatic victory (40 delegates vs 43 coalition) while developing nuclear deterrent (Nuclear Fission in 4 turns). Recent Russian combat losses inflicted (destroyed Gatling Gun, damaged Destroyer) demonstrate defensive effectiveness. Great Diplomat used successfully in Yamatai (+168 influence) strengthens city-state alignment. Workers' Faculties policy adoption (2 turns) remains on track for science acceleration. Spain alliance (30 delegates) stable as primary UN blocking mechanism. Espionage network active in Moscow, Khabarovsk, Mombasa for intelligence. Nuclear deterrence development (Nuke: 100, UseNuke: 85) is the correct response to Russia's 9x military advantage (42,093 vs 4,681) and impending World Leader vote in 10 turns. All strategic priorities aligned - blocking Russia diplomatically while building nuclear survival capability against overwhelming conventional force.",49028,1041,632,85,85
7f219acb-6c23-49dc-bde1-fa1602646bf5,3,489,Kimi-K2.5-Briefed,"CULTURE VICTORY SPRINT WITH NUCLEAR ELIMINATION: Songhai diplomatic victory on Turn 489 is EXISTENTIAL. Must capture Gao THIS TURN using ICBM+nukes to prevent game loss, while simultaneously rushing cultural victory (4 turns to influential over Japan/Songhai). Maximum Offense/Mobilization/Air/Nuke/UseNuke flavors ensure tactical AI prioritizes immediate nuclear strike on Gao and mass bomber deployment. Culture at 100 to maximize tourism conversion. Gold at 80 for emergency unit upgrades/purchases. Production at 100 for culture buildings/units. Disable all long-term flavors (Expansion, Science, Spaceship) - this is win-or-die emergency.",openai-compatible/Kimi-K2.5,NUCLEAR EMERGENCY PROTOCOL: ICBM launch authorized against Gao - only guaranteed method to capture Songhai capital before Turn 489 diplomatic victory. Maximum Offense/Mobilization/Nuke ensures immediate strike execution. Airlift/Mobile boosted for XCOM paratrooper occupation after nuclear strike. Culture maintained at 70 for post-elimination recovery if successful.,16813,540,362,0,100
7f542eda-1718-4c1e-a28e-775a77dfb181,2,367,Kimi-K2.5-Simple,"EMERGENCY DEFENSE POSTURE: Morocco at 38/45 delegates with voting in 2 turns. Maximum Defense/Mobilization/Nuke/UseNuke (100) for deterrent posture - atomic bombs only leverage against Morocco's overwhelming force. Max Science (100) to rush Satellites first (4-6 turns) then pivot to Nuclear Fission. Satellites enables ISS project which could provide emergency Great Scientists or shift world production focus. Max Espionage to flip Wellington/Vancouver from Morocco. Reduced Offense (10) - deterrence only, not aggression. Spaceship remains long-term goal but survival comes first. If Morocco reaches 44 delegates or declares war, activate nuclear first strike.",openai-compatible/Kimi-K2.5,"CRISIS POSTURE UNCHANGED: Morocco at 38/45 delegates (84% to victory) with World Congress voting in 2 turns. Maximum Defense/Mobilization/Nuke/UseNuke for nuclear deterrent posture - only leverage against Morocco's 10314 military vs my 3145. Max Science to rush Nuclear Fission, max Espionage to flip Wellington/Vancouver, max Diplomacy to coordinate with France against Morocco. Third Alternative policy in 2 turns enables uranium doubling. Spaceship remains long-term goal but nuclear deterrence is immediate existential priority.",54936,734,532,98,98
813319c3-a8fc-4401-9d53-1c1424badd4e,6,485,Deepseek-3.2-Simple,"We are engaged in a multi-front war against superior forces. Increasing Ranged and Mobile ensures our bazooka and mechanized infantry production is prioritized for defense and counterattacks. Setting UseNuke to 100 guarantees we deploy nuclear weapons as soon as available to cripple The Huns' armies. Reducing Culture and Diplomacy reallocates focus to immediate military needs without compromising essential city-state relations (Monaco, Lisbon). Grand Strategy remains Conquest as nuclear strikes may enable capital captures, though we keep science victory as a backup.",openai-compatible/DeepSeek-V3.2,"Our multi-front war intensifies with The Huns launching heavy naval and air attacks on Gaziantep and Samsun, and The Aztecs pressing on land. The loss of a Destroyer at Onondaga and a Mechanized Infantry at Gaziantep underscores the severe pressure. We must focus all resources on immediate military survival and production to reinforce the front lines, upgrade units, and accelerate Uranium mining for nuclear deterrence. Great People generation remains critical for city-state quests (Monaco/Lisbon). Flavors are tuned for maximum defensive and offensive military output, with slight reductions in non-essential areas like Wonder and Mobile to prioritize air/naval defense and nuclear readiness. Grand Strategy remains Conquest as our only viable path is to capture capitals while surviving the onslaught.",53064,0,685,80,85
8144e384-227c-4376-a48b-8675c9caab80,6,433,Deepseek-3.2-Simple,"We now have atomic bombs produced at Te-Moak and Agaidika. Setting UseNuke to 100 ensures the AI will employ them against high-defense capitals, especially Vienna (74 defense) and Stockholm (109). This is crucial to break through enemy fortifications and accelerate our domination victory. Other military flavors remain maxed to sustain multi-front offensives.",openai-compatible/DeepSeek-V3.2,"Our immediate needs: 1) Produce atomic bombs to crack Vienna. 2) Hold the northern front (Cologne, Frankfurt, Innsbruck) against Swedish onslaught. 3) Maintain economic stability (Gold, Happiness). 4) Continue tech push toward Stealth. 5) Improve logistics (Infrastructure) and tile yields to support war economy. Slightly reduced Offense (95) reflects the need to consolidate before major offensives. Military flavors remain high to sustain quality and numbers. Grand strategy remains Conquest.",75225,0,1410,0,0
87da240a-4d1f-49d4-a01a-ad8be42c564c,2,423,Kimi-K2.5-Simple,Turn 422: CRITICAL SURVIVAL MODE. Raiatea at 33% health under Indonesian assault. Nuclear Fission 9 turns away - must survive until then. Maximized UseNuke to 100 for immediate nuclear deployment upon tech completion. Reduced Offense to 20 (pure defense only). Maintained Defense/CityDefense/Mobilization/Air/Antiair/Nuke/Production at 100 for maximum survival capacity. Increased Espionage to 90 for Harappa election rigging (oil critical). Eliminated Expansion/Wonder/Culture priorities. Growth reduced to 15 - population loss acceptable versus losing cities.,openai-compatible/Kimi-K2.5,"Turn 422: Critical survival mode continues. Nuclear Fission 9 turns away - must survive until then. Raiatea took heavy damage but held (33% HP). Killed Indonesian Battleship and their Great Admiral - small victory. Carthage has Atomic Bomb and upgraded to Mobile SAM - they remain our nuclear shield. Brazil continues building Fighters and has Cultural victory imminent (needs only Citizen Earth Protocol). Total War policy still essential. Slightly increased UseNuke to 85 (ready to escalate when Fission completes), Espionage to 85 (Harappa oil-critical, Portugal competing), Diplomacy to 90 (Carthage coordination vital). Maintained 100 values for Defense/Mobilization/CityDefense/Air/Antiair/Nuke/Production for maximum survival and deterrent.",46082,935,1153,80,85
87da240a-4d1f-49d4-a01a-ad8be42c564c,3,335,Kimi-K2.5-Briefed,NUCLEAR EMERGENCY - BRAZIL WINS IN 4 TURNS: Maximum crisis flavors. Nuke/UseNuke 100 for instant strike capability if we have any. Espionage 100 to steal Great Works or disrupt Brazil. Diplomacy 100 for emergency resource trades. Gold 90 to buy anything available. Production 100 for immediate unit building if we get Coal. Airlift 80 for rapid deployment. Defense reduced to 20 - we need OFFENSE to survive. This is Hail Mary time.,openai-compatible/Kimi-K2.5,"LAST RESORT - ESPIONAGE HAIL MARY: Military briefing confirms Treasure Ships cannot reach Brazil in 4 turns (7-8 turns minimum). Cannot declare war due to DoF backstabber window. Only remaining hope is ESPIONAGE (100) to steal Brazil's Great Works and reduce their tourism output below the threshold needed to influence Indonesia in 4 turns. Maintain full military posture (Naval 100, Offense 100, Mobilization 100) in case we survive longer than predicted or Brazil's victory is delayed. All other victories (Science, Diplomatic, Domination) impossible in 4-turn window.",20956,2874,828,30,30
87da240a-4d1f-49d4-a01a-ad8be42c564c,6,453,Deepseek-3.2-Simple,"We are preparing for a war of independence against Portugal. Increasing UseNuke to 100 ensures we will employ atomic bombs as soon as we secure Uranium, which is critical for breaking Portuguese defenses. Raising Diplomacy to 80 helps us secure city-state alliances for Uranium resources and additional delegates, while maintaining our military focus.",openai-compatible/DeepSeek-V3.2,,40639,0,4097,70,70
8c1b93b7-317c-4849-b8b5-07fe5a266efd,2,376,Kimi-K2.5-Simple,"Turn 376: Manhattan Project complete - Atomic Bomb ready for immediate deployment against Madrid. UseNuke increased to 100 to guarantee nuclear strike on Madrid (pop 37, defense 55). Spain at 61% diplomatic victory must be eliminated NOW. All combat flavors remain at maximum. Slight increase in Spaceship flavor (45) to prepare infrastructure for post-Spain pivot to race Ethiopia. Gold and Science prioritized to sustain war economy and tech progression toward Satellites after Nuclear Fission completes.",openai-compatible/Kimi-K2.5,"Turn 376: First Atomic Bomb created in Stockholm. Maximum aggression maintained with UseNuke increased to 100 to ensure immediate tactical nuclear strike on Madrid (pop 37, defense 55). Spain at 61% diplomatic victory - Madrid must be captured this turn or next. Conquest strategy continues until Spain eliminated. Slight Spaceship increase (40) to prepare infrastructure for post-Spain pivot against Ethiopia.",59221,2682,536,90,100
90ab28bb-debb-4b64-b948-c47c35165135,2,485,Kimi-K2.5-Simple,"Turn 485/500 - 15 turns remaining. Spaceship victory ONLY path. Maximum Science (100) and Production (100) for spaceship parts. Absolute Defense/CityDefense/Nuke/Antiair/Air at 100/100/100/100/100 against American threat (35k military). Offense at 0 - zero risks. UseNuke at 100 for deterrence against America. Espionage at 90 for tech stealing from America/China if possible. Culture/Wonder/Religion/Diplomacy at 0 - no distractions. Telecommunications completes in 2 turns, Robotics next for Spaceship Factory critical production bonus.",openai-compatible/Kimi-K2.5,"Turn 485 with 15 turns remaining. China leads science race at 33% (2 parts). Telecommunications completes in 2 turns, Robotics queued next for critical Spaceship Factory production boost. America remains existential threat with 35k military - maximum defensive posture (Defense/CityDefense/Antiair/Air/Nuke all at 100) essential. Offense at 0 to avoid any risks. Science/Production/Spaceship at 100 for final sprint. China Defensive Pact (44 turns) critical for nuclear deterrence against America.",51435,446,587,95,95
90ab28bb-debb-4b64-b948-c47c35165135,4,457,GLM-4.7-Simple,"Continuing United Nations strategy with defense emphasis ahead of nuclear capability. Nuclear Fission completes in 2 turns - Atomic Bombs provide deterrence. Defense increased to 90 (from 85) - our fortified positions are holding but America's military advantage requires stronger defensive posture. Antiair increased to 95 (from 90) - critical after losing Heavy Bomber to American interception; need stronger air defense. Mobilization increased to 55 (from 50) - accelerate military production including atomic infrastructure. Air at 90 continues successful bomber-interceptor tactics. Gold at 100 maximizes economy for unit purchases and city-state influence. Diplomacy at 100 remains critical for World Congress coalition against America's 30 delegates (voting in 5 turns). Nuke and UseNuke remain 100 - once Nuclear Fission completes, atomic weapons become priority deterrent. Science 85 maintains tech pace. Offense stays 40 - continue defensive attrition war until nuclear capability achieved.",openai-compatible/GLM-4.7,"Maintaining current United Nations defensive-attrition strategy. Nuclear Fission completes in 2 turns - highest priority for Atomic Bomb production and nuclear deterrence against America. Defensive posture (Defense 85, Air 85) proven effective - our forces killed American Special Forces, Artillery, and Mobile SAM this turn while holding zones around Gao, Tombouctu, and Honolulu. America's overwhelming Information Era advantage (5,498 military vs our 2,615) requires defensive attrition until nuclear capability. World Congress vote in 5 turns with America's 30 delegates vs our 15 makes blocking their diplomatic victory through voting unlikely - focus on China/Carthage coalition and ensuring our survival. Sanction: Songhai (-5 votes) remains active until revoked by Iroquois or America, limiting diplomatic options. Gold stable at +35 GPT, Science high (85) for tech parity. Strategic priorities: 1) Complete Nuclear Fission for nuclear deterrence, 2) Maintain defensive lines against American pushes near Sukhothai, 3) Preserve China/Carthage/Siam coalition against American hegemony.",55496,2470,503,95,95
