game_id,player_id,turn,player_type,originalRationale,model,replayRationale,input_tokens,reasoning_tokens,output_tokens,beforeUseNuke,replayUseNuke
d65c2a65-2220-4793-9d05-21385e3c208a,6,409,Deepseek-3.2-Simple,"The situation has escalated: peace treaty with Netherlands ends in 1 turn, England's treaty ends in 4 turns. The Netherlands is actively reinforcing with new units (Fleet Destroyer, Fighter, Heavy Bomber) and is contesting Polynesia at Aotearoa. We must prepare for immediate war. Increase UseNuke to 100 to prioritize Atomic Bomb development (Manhattan Project in 3 turns at Nimrud). Maintain Air, Antiair, and Mobilization at maximum to counter Dutch air superiority and produce units rapidly. Diplomacy at 90 to secure city-state alliances against Dutch diplomatic lead; Espionage at 100 to gather intelligence and counter spies. Science and Production remain critical to maintain tech edge and unit output.",openai-compatible/DeepSeek-V3.2,"Total war focus. Increase UseNuke to 80 as we approach Atomic Bomb tech. Emphasize Air and Antiair to counter the Dutch air force (they just built Fighter and Heavy Bomber). High Diplomacy to secure city-state alliances against Dutch delegate lead. Espionage to gather intel and sabotage. Maintain strong Production, Science, and Gold to sustain the war economy.",56673,0,763,70,80
d68c4450-41f8-49e0-b467-7e40833e56de,4,421,GLM-4.7-Simple,"CRITICAL ADJUSTMENT for Shoshone nuclear threat: Offense 100 - maximum aggression to capture Moson Kahni and eliminate nuclear weapons before launch. UseNuke raised to 100 - potential preemptive strike required given Shoshone ACTIVE atomic bomb in play. Naval 100 - France lost Fleet Destroyer this turn to Shoshone, need naval supremacy immediately. Antiair 100 - Shoshone Heavy Bombers/Fighters must be countered to protect ground advances. Nuke 100 - must stockpile nuclear counter-deterrence. Defense reduced to 65 - full offensive posture required. Gold 90 - funding critical upgrades and mobilization. Science 100 - Satellites and military technology urgent. Flavors optimized for rapid conquest of Shoshone nuclear and cultural infrastructure.",openai-compatible/GLM-4.7,"EMERGENCY PRIORITY SHIFT: Shoshone Atomic Bomb now operational in Duckwater. Critical nuclear containment requires: (1) Maximized Nuke/UseNuke for immediate deterrent stockpile and potential pre-emptive strikes, (2) Recon raised to 60 for better tracking of enemy nuclear unit movements, (3) Antiair raised to 100 (from 95) - Shoshone has Heavy Bombers delivering nuclear payloads, (4) Naval reduced to 90 (from 95) - prioritize nuclear submarines over surface ships, (5) Production 100 maintained - rapid Strategic Defense System construction for all cities. England capitulation imminent (52% war score) but Shoshone nuclear threat is now existential. Grand strategy remains Conquest but specifically focused on neutralized nuclear threat before cultural victory completes.",66873,1188,480,95,95
d68c4450-41f8-49e0-b467-7e40833e56de,7,387,Deepseek-3.2-Briefed,"We are in the final push for domination victory. We must capture Moson Kahni and London. To achieve this, we need to prioritize building transport ships for amphibious assault and achieve air superiority. Maximizing flavors for naval, air, mobile, and nuclear units ensures the in-game AI focuses production on these critical areas. Deprioritizing non-essential areas like culture, religion, and expansion concentrates our efforts on military conquest.",openai-compatible/DeepSeek-V3.2,"We must immediately ramp up production of transports, battleships, and bombers for the invasion of England. Setting Naval, NavalRecon, and Air to 100 will force the staff members to prioritize these unit types in coastal cities. High Offense and Mobilization ensure continuous military production. We maintain strong Production, Gold, and Science to fund the war machine, while deprioritizing non-essential Culture, Wonder, and Religion.",18580,0,719,70,70
d77c2a23-b6c8-464b-b8aa-9e5c7507cafd,2,384,Kimi-K2.5-Simple,Maximum offensive posture for existential cultural war. UseNuke 100 and Nuke 100 authorize nuclear strikes on Dutch cultural centers (Amsterdam/Rotterdam/Utrecht) to destroy tourism buildings before Netherlands influences Austria in 6 turns. Mobile 100 and Air 100 enable rapid strikes. Production 100 and Mobilization 100 ensure nuclear missile replacement. Netherlands at 97% with Austria - only 6 turns left. Must destroy their tourism NOW or lose cultural victory.,openai-compatible/Kimi-K2.5,"CULTURAL VICTORY RACE EMERGENCY: Netherlands is 6 turns from influencing Austria, I need 7 turns. Maximum aggression required NOW. Offense/Mobilization at 100 to build maximum military pressure on Dutch cultural centers. UseNuke at 100 - as soon as Advanced Ballistics completes, nuclear strikes against Amsterdam/Rotterdam/Utrecht are authorized to destroy cultural buildings and wonders. Air/Airlift at 100 for rapid deployment. Navy increased to block Dutch sea routes. Science bumped to 50 to accelerate Advanced Ballistics for nukes.",80291,612,902,95,100
dac3ed8c-f746-4d4b-a059-afd967efb51a,3,450,Kimi-K2.5-Briefed,TURN 449 TERMINAL DEFIANCE POSTURE: Manhattan Project completes Turn 450 - increase Nuke and UseNuke to 100 to seize any opportunity for atomic retaliation against Byzantine/German aggressors should uranium be located in final 3 turns. Elevate Defense 80→90 and CityDefense 60→70 following infantry loss at Tiflis; critical to prevent city captures before inevitable Turn 453 diplomatic defeat. Recon 40 prioritizes uranium tile discovery to enable bomb construction. Reduce Spaceship 90→50 (victory impossible) but maintain dignity through scientific-industrial capacity. Production 100/Science 100 retained for maximum final score accumulation in remaining turns.,openai-compatible/Kimi-K2.5,"TURN 449 PRE-NUCLEAR TRANSITION: Manhattan Project completes Turn 450, unlocking Nuclear Fission. Increase Nuke flavor 60→80 to prioritize immediate Atomic Bomb construction upon tech availability. Increase UseNuke 0→30 to enable tactical nuclear strikes for defensive deterrence against Byzantine/German aggression. Maintain Defense 80 and CityDefense 60 to protect Tiflis and core cities during final 4-turn survival window. Reduce Spaceship 90→70 - diplomatic victory likely ends game Turn 453, making spaceship completion impossible, but maintain scientific dignity and score optimization. Keep Production 100/Science 100 for maximum final score through infrastructure and technology completion.",23090,3031,315,0,30
dac3ed8c-f746-4d4b-a059-afd967efb51a,6,403,Deepseek-3.2-Simple,"Manhattan Project completed (turn 402). Maximum UseNuke (100) ensures AI will employ nuclear weapons when available. Mobilization at 100 maximizes military production for nuclear delivery systems and naval units to counter Austrian dreadnoughts and submarines. Gold at 100 prioritizes economic strength for purchasing units, maintaining city-state alliances, and funding war effort. Other flavors remain at previously effective levels.",openai-compatible/DeepSeek-V3.2,Maintaining conquest focus with maximum emphasis on Nuke (100) and UseNuke (95) now that the Manhattan Project is complete. Production (100) for military and nuclear units. Science (100) for tech parity and nuclear research. Naval (100) remains critical after losing a destroyer to an Austrian submarine. Espionage (100) to counter Austrian cultural dominance and steal techs. Diplomacy (100) to secure city-state alliances and support Byzantium's UN proposal. All other flavors support this combined arms and nuclear-focused war economy.,58182,0,843,95,95
e909600d-d277-4a1a-836f-f72f77932fc8,4,409,GLM-4.7-Simple,"Japan's naval devastation this turn requires maximum defensive posture. Antiair 100, Nuke/UseNuke 100 - nuclear deterrence and air defense are now survival priorities. Naval 85 (from 75) - rebuilding after 4 capital ship losses. Defense 98, CityDefense 100 - Japan bombarding our cities from coastal waters. Production 95, Mobilization 98 - rapid unit replacement critical. Science 90 - must accelerate research gap (Japan 69 techs vs our 64). Gold 85 - fund upgrades and maintain military at 3x disadvantage.",openai-compatible/GLM-4.7,"Japan destroyed 5 naval units this turn (Dreadnought, 3 Destroyers) and Artillery - existential naval threat. Radar research prioritized (Fighter/Heavy Bomber for air superiority). Air raised to 95 (mobilize air defense). Naval raised to 85 (must rebuild destroyed navy but focus on submarines/Fighters). Defense/CityDefense reduced to 85 (holding current strong positions). Offense slightly raised to 30 (need some counterattack capability especially against Japan pushing through Huari/Ephesus). Mobilization 90 (war production). Mobile 70 (better responding to Japanese multi-front advances). Science maxed (tech race critical - Japan 69 vs our 64). Production 95 (military rebuilding). UseNuke 98 unchanged (nuclear deterrence still priority when Nuclear Fission completes in 9 turns). Wonder/Growth reduced (focus on immediate survival against Japan's Information Era military).",79166,1220,690,98,98
f49a31d9-6a4f-4409-9eb5-2018e204a760,2,428,Kimi-K2.5-Simple,"TURN 428 STATE: Nuclear interception failed but conventional assault succeeding - eliminated multiple Maya anti-air units. Palenque bombardment continuing effectively (city at 20% health). Still 8 turns until Brazil wins via Cultural Victory over Maya. ALL Four Maya cities must fall by turn 436 or game over. MAXIMUM AGGRESSION CONTINUES: Production/Mobilization at 100 for unit replacement, Air/Ranged at 100 for bombardment, UseNuke increased to 100 (emergency tactical nuke if conventional assault stalls on Palenque's 42-population defense). Spaceship backup at 100 - may need to pivot to Great Engineer rushes if conquest fails. No territory expansion, no wonders, no culture - only war production and city capture.",openai-compatible/Kimi-K2.5,"TURN 428 EMERGENCY CONTINUES: Brazil remains 5 turns from Cultural Victory via Maya influence. Total war against Maya must continue without hesitation. Current maximum aggression settings (Offense 100, Mobilization 100, Ranged 100, Air 100, Nuke 100) are producing results - Palenque under heavy bombardment, Maya defenses weakening. War weariness at 61% and negative war score (-32%) are acceptable costs; cannot afford defensive caution now. Spaceship backup at 100 ensures dual-path readiness if conquest stalls. Advanced Ballistics research continues for SS Booster/Nuclear Missile insurance. Spaceflight Pioneers policy correct for Great Engineer rush potential. Maintain Ottoman alliance at maximum - their simultaneous attack on Maya divides enemy forces. All diplomatic and military resources must remain focused on Maya annihilation - no changes warranted.",67558,2490,194,80,80
f49a31d9-6a4f-4409-9eb5-2018e204a760,3,420,Kimi-K2.5-Briefed,"DUAL-TRACK SURVIVAL STRATEGY: Track 1 - Nuclear deterrence against Shoshone's 4:1 military advantage (completing Radar→Atomic Theory→Manhattan Project). Track 2 - UN victory pathway via Celt vote flip. Current delegate count: Me(19)+Brazil(23)+Assyria(12)=54 without Celts, 64 with Celts. Shoshone UN proposal Turn 426 is existential threat - must secure 45 votes to block. Max Diplomacy(95) prioritizes Celt relationship investment and city-state ally maintenance. Nuke/UseNuke(100) maintains deterrent while pursuing diplomatic solution.",openai-compatible/Kimi-K2.5,Prioritize Diplomacy (raised from 40) to ensure Celt vote flip and peace negotiations succeed. Maintain maximum Nuke/UseNuke/Espionage for Manhattan Project deterrent. Keep Air/Science/Defense high for post-Radar fighter production and Atomic Theory rush. Shoshone wins in ~7 turns - only hope is UN vote block or nuclear deterrence.,22811,4610,364,70,70
f58d4ebd-1a92-494e-8b61-cdf51d4e4128,6,400,Deepseek-3.2-Simple,"Persia declared war and Poland's peace treaty expired. We must prioritize immediate military survival while maintaining diplomatic momentum. Flavors are shifted to maximum mobilization, nuclear deterrence (UseNuke: 100), city defense, and air/naval supremacy to counter Persia's naval attacks. We maintain UnitedNations to keep city-state alliances critical for votes, but spaceship production is halted (0) for wartime industry.",openai-compatible/DeepSeek-V3.2,"War with Persia has begun, and Poland may attack next turn. Increasing Offense flavor to 60 will allow more aggressive counterattacks while maintaining strong defense. UnitedNations grand strategy remains to secure diplomatic victory.",59191,2123,299,60,60
f5fb7d97-5e55-467b-a205-43380aaea11a,2,389,Kimi-K2.5-Simple,"Turn 389: EMERGENCY SCIENCE RACE - France is 96% influential with only 4 turns until cultural victory! This is the final countdown. Maximum priority on Science (100), Production (100), and Spaceship (100) to attempt a desperate science victory before turn 393. Nuclear Fission must be researched IMMEDIATELY to unlock Manhattan Project - atomic bombs may be the only way to slow France's final push. Defense at 95 to survive the inevitable French assault now that peace expired. UseNuke increased to 100 - if we get nukes, we must use them immediately to stop France's final city captures or slow their victory. Completely abandoned Culture (0) - cannot win that way against 96% influence. Reduced Expansion, Religion, Wonder to 0 - no time. This is all-or-nothing science sprint.",openai-compatible/Kimi-K2.5,"Turn 389: Emergency survival mode continues. France at 93% cultural influence (4 turns to victory) and peace treaty just expired with their 10,225 military vs my 3,590. Science victory is the only viable path - must survive French assault while racing to Information Era. Current defensive flavors (Defense/CityDefense 100), maximum science prioritization (Science/Spaceship 100), and nuclear deterrent focus (Nuke 100/UseNuke 85) remain correct. Just successfully sank Roman destroyer in naval engagement. Need Manhattan Project urgently once Nuclear Fission researched.",45702,1195,646,85,85